{
  "meta": {
    "version": "v2.28.0",
    "feature": "Conflict Detection Foundation",
    "mode": "read-only-preview"
  },
  "summary": {
    "conflictsFlagged": 7,
    "critical": 2,
    "warnings": 4,
    "cleared": 3,
    "draftRunsReviewed": 2
  },
  "filters": {
    "dateRange": "2026-06-14 to 2026-06-20",
    "agency": "Central Dispatch",
    "view": "Supervisor"
  },
  "sources": [
    {
      "label": "Assignment Generator",
      "status": "connected",
      "description": "Reviews draft assignments and generated run IDs before publishing."
    },
    {
      "label": "Daily Board",
      "status": "connected",
      "description": "Checks coverage spots, open slots, and shift windows."
    },
    {
      "label": "Leave Banks / Requests",
      "status": "connected",
      "description": "Flags employees assigned while approved or pending leave affects coverage."
    },
    {
      "label": "Training & Certifications",
      "status": "connected",
      "description": "Flags training conflicts and missing/expired qualifications."
    },
    {
      "label": "Mandation / Rest Rules",
      "status": "planned",
      "description": "Previews rest, consecutive hour, and forced OT rule violations."
    }
  ],
  "conflicts": [
    {
      "id": "conf-001",
      "severity": "critical",
      "type": "double_assignment",
      "employee": "Morgan Price",
      "date": "2026-06-14",
      "shift": "0700-1900",
      "spot": "Dispatcher D1",
      "message": "Employee appears assigned to Dispatch D1 and Training Block T2 during overlapping hours.",
      "recommendedAction": "Resolve before publishing generated assignments.",
      "status": "open",
      "visibility": "supervisor"
    },
    {
      "id": "conf-002",
      "severity": "critical",
      "type": "below_minimum",
      "employee": "Open Spot",
      "date": "2026-06-14",
      "shift": "1900-0700",
      "spot": "Dispatcher D3",
      "message": "Coverage is below minimum by one dispatcher after leave impact is applied.",
      "recommendedAction": "Offer OT, approve volunteer, or review mandation options.",
      "status": "open",
      "visibility": "employee"
    },
    {
      "id": "conf-003",
      "severity": "warning",
      "type": "missing_qualification",
      "employee": "James Hall",
      "date": "2026-06-15",
      "shift": "1700-0500",
      "spot": "Police Radio P1",
      "message": "Employee is assigned to a spot requiring Police Radio qualification not currently shown as active.",
      "recommendedAction": "Confirm qualification or select eligible employee.",
      "status": "review",
      "visibility": "supervisor"
    },
    {
      "id": "conf-004",
      "severity": "warning",
      "type": "rest_rule",
      "employee": "April Stone",
      "date": "2026-06-16",
      "shift": "0500-0900",
      "spot": "Calltaker C2",
      "message": "Draft assignment may violate configured minimum rest period after prior shift.",
      "recommendedAction": "Supervisor may override with reason if agency policy allows.",
      "status": "review",
      "visibility": "supervisor"
    },
    {
      "id": "conf-005",
      "severity": "warning",
      "type": "leave_overlap",
      "employee": "Devon Lee",
      "date": "2026-06-17",
      "shift": "0700-1500",
      "spot": "Dispatcher D2",
      "message": "Employee has pending approved leave impact during part of this shift.",
      "recommendedAction": "Convert to open spot or adjust leave request coverage impact.",
      "status": "review",
      "visibility": "employee"
    },
    {
      "id": "conf-006",
      "severity": "warning",
      "type": "over_maximum",
      "employee": "Extra Coverage",
      "date": "2026-06-18",
      "shift": "1300-1700",
      "spot": "Dispatcher Float",
      "message": "Draft board exceeds configured maximum staffing for the role/time block.",
      "recommendedAction": "Confirm training/overlap reason or remove extra coverage.",
      "status": "review",
      "visibility": "supervisor"
    },
    {
      "id": "conf-007",
      "severity": "info",
      "type": "manual_override",
      "employee": "Taylor Reed",
      "date": "2026-06-19",
      "shift": "1900-0700",
      "spot": "Supervisor S1",
      "message": "Manual override exists and should be preserved when publishing generated assignments.",
      "recommendedAction": "No action unless override is no longer needed.",
      "status": "cleared",
      "visibility": "admin"
    }
  ],
  "ruleChecks": [
    {
      "rule": "No double assignment within overlapping time windows",
      "level": "hard",
      "status": "failing"
    },
    {
      "rule": "Minimum staffing by role and time block",
      "level": "hard",
      "status": "failing"
    },
    {
      "rule": "Required qualifications for specialized spots",
      "level": "soft",
      "status": "review"
    },
    {
      "rule": "Minimum rest / max consecutive hours",
      "level": "soft",
      "status": "review"
    },
    {
      "rule": "Approved leave removes employee from coverage",
      "level": "hard",
      "status": "review"
    },
    {
      "rule": "Manual overrides remain visible and audited",
      "level": "soft",
      "status": "passing"
    }
  ],
  "rolePanels": [
    {
      "role": "employee",
      "label": "Employee conflict visibility",
      "visibleItems": [
        "Conflicts affecting my assignment",
        "Open coverage warnings",
        "Action needed from me"
      ],
      "hiddenItems": [
        "Internal notes",
        "Other employee protected reasons",
        "Admin override rationale"
      ]
    },
    {
      "role": "supervisor",
      "label": "Supervisor conflict visibility",
      "visibleItems": [
        "Full conflict queue",
        "Recommended fixes",
        "Override-needed warnings",
        "Coverage impact"
      ],
      "hiddenItems": [
        "System-level schema controls"
      ]
    },
    {
      "role": "admin",
      "label": "Admin conflict visibility",
      "visibleItems": [
        "Rule severity controls",
        "Hard/soft rule review",
        "Override audit details",
        "Future publish safeguards"
      ],
      "hiddenItems": []
    }
  ],
  "resolutionQueue": [
    {
      "priority": 1,
      "item": "Resolve critical double assignment before publish.",
      "owner": "Supervisor",
      "status": "required"
    },
    {
      "priority": 2,
      "item": "Fill under-minimum Dispatcher D3 on night shift.",
      "owner": "Supervisor",
      "status": "required"
    },
    {
      "priority": 3,
      "item": "Review missing qualification warning for James Hall.",
      "owner": "Admin",
      "status": "review"
    },
    {
      "priority": 4,
      "item": "Confirm rest-rule override path for April Stone.",
      "owner": "Supervisor",
      "status": "review"
    }
  ],
  "rules": [
    "Conflict Detection is read-only in v2.28.0.",
    "No draft assignment is auto-published from this page.",
    "Hard-rule conflicts should block future publish workflows unless an admin-defined override allows it.",
    "Soft-rule conflicts should require supervisor acknowledgement and an audit reason.",
    "Role-based panels continue to replace duplicate -admin pages unless a workflow is truly separate."
  ]
}
